{
  "eccac": { "version": "1.0.0", "spec": "1.0.0" },
  "component": {
    "name": "mind-node",
    "type": "I",
    "owner": "mindmap",
    "lifecycle": "stable",
    "stability": "stable"
  },
  "contracts": { "published": [], "subscribed": [] },
  "dependencies": { "runtime": [], "components": ["connector-line"] },
  "metadata": {
    "description": "Adaptive mindmap node — renders as a leaf or a branch from data-has-children. One component replaces the old branch-node + leaf-node split; a leaf morphs into a branch automatically when it gains children."
  },
  "aiUi": {
    "enabled": true,
    "alias": "mind-node",
    "title": "Mind Node",
    "category": "Mindmap",
    "preferred": true,
    "summary": "Adaptive mindmap node: status, tag, optional collapse/count, bottleneck; leaf or branch from data-has-children",
    "template": "<div class=\"mind-node\" data-status=\"pending\" data-tag=\"module\"><span class=\"mind-node__status\"></span><span class=\"mind-node__topic\">Topic</span><span class=\"mind-node__tag\">module</span><button class=\"mind-node__collapse\" aria-label=\"Collapse\" type=\"button\"></button><span class=\"mind-node__count\">0/0</span></div>",
    "propsSchema": {
      "topic": "string",
      "status": "string",
      "tag": "string",
      "kind": "string",
      "hasChildren": "boolean",
      "collapsed": "boolean",
      "childCount": "number",
      "doneCount": "number",
      "bottleneck": "string"
    },
    "defaultSlot": "default",
    "slots": { "default": { "selector": ":root", "allowedChildren": [] } },
    "allowedChildren": [],
    "render": {
      "kind": "element",
      "tag": "div",
      "className": "mind-node",
      "attributes": {
        "data-status": { "prop": "status" },
        "data-tag": { "prop": "tag" },
        "data-kind": { "prop": "kind" },
        "data-has-children": { "prop": "hasChildren" },
        "data-collapsed": { "prop": "collapsed" },
        "data-bottleneck": { "prop": "bottleneck" }
      },
      "children": [
        { "tag": "span", "className": "mind-node__status" },
        { "tag": "span", "className": "mind-node__topic", "textProp": "topic" },
        { "tag": "span", "className": "mind-node__tag", "textProp": "tag" },
        { "tag": "button", "className": "mind-node__collapse", "attributes": { "aria-label": "Collapse", "type": "button" } },
        { "tag": "span", "className": "mind-node__count" }
      ],
      "template": "<div class=\"mind-node\" data-status=\"pending\" data-tag=\"module\"><span class=\"mind-node__status\"></span><span class=\"mind-node__topic\">Topic</span><span class=\"mind-node__tag\">module</span><button class=\"mind-node__collapse\" aria-label=\"Collapse\" type=\"button\"></button><span class=\"mind-node__count\">0/0</span></div>"
    },
    "behavior": {
      "role": "container",
      "events": [],
      "targetActions": [],
      "intentMap": {},
      "fieldValue": null,
      "eventTargetSelector": ".mind-node"
    },
    "style": {
      "surfaceAware": true,
      "supportsVariant": false,
      "supportsSize": false,
      "supportsTone": false
    },
    "textTargets": {
      "topic": [".mind-node__topic"],
      "tag": [".mind-node__tag"],
      "count": [".mind-node__count"]
    }
  }
}
